<!ELEMENT listaautomoveis (automovel*)>
<!ELEMENT automovel (descricao, caracteristicas, preco)>
<!ELEMENT descricao (#PCDATA)>
<!ATTLIST descricao combustivel CDATA #REQUIRED>
<!ELEMENT caracteristicas (cor, quilometragem, fotografia, obs)>
<!ELEMENT cor (#PCDATA)>
<!ATTLIST cor nome CDATA #REQUIRED>
<!ELEMENT quilometragem (#PCDATA)>
<!ELEMENT fotografia (#PCDATA)>
<!ELEMENT preco (#PCDATA)>
<!ELEMENT obs (#PCDATA)>
